{
    "name": "AirPods (Right, 3rd generation)",
    "identifier": [
        "AirPods1,3",
        "Audio2,1",
        "Device1,8211"
    ],
    "key": "Audio2,1-right",
    "soc": "H1",
    "arch": "armv7",
    "type": "AirPods",
    "board": "B688AP",
    "model": "A2565",
    "released": "2021-10-26"
}